,Unnamed: 0,sentences,name,country,page,languages,legible,results,class
1696,1882,5.8.4 provide mining firms and entrepreneurs access to information and facilitate public participation in ea processes. ,National Environment Policy,,48,en,5.8.4 provide mining firms and entrepreneurs access to information and facilitate public participation in ea processes.,0.41910789439434104,n
1699,3154,5.8.9 provide incentives for use of mining technologies that are 5.8.1 0 build capacity in the mining sector. ,National Environment Policy,,49,en,5.8.9 provide incentives for use of mining technologies that are 5.8.10 build capacity in the mining sector.,0.41431783782637893,n
1706,17122,"5.9.7 establish environmental focal point in the institution responsible for tourism that will constantly lase with the environmental affairs to ensure that all sectors of the economy optimise use of environmentally friendly technologies and undertake mitigation measures to address adverse a all sectors shall institute policies and programmes that support the overall policy goal of sustainable social and economic development through the sound management and conservation of the environment.involve all stakeholders in planning, implementation and monitoring of 5.1 0.1. promote transport and other infrastructure that is environmentally friendly through proper site selection, choice of technology, and the application of conservation measures along and within the 5.1 0.2. encourage the use of less polluting technologies in all sectors. ",National Environment Policy,,50,en,"5.9.7 establish environmental focal point in the institution responsible for tourism that will constantly lase with the environmental affairs to ensure that all sectors of the economy optimise use of environmentally friendly technologies and undertake mitigation measures to address adverse a all sectors shall institute policies and programmes that support the overall policy goal of sustainable social and economic development through the sound management and conservation of the environment.involve all stakeholders in planning, implementation and monitoring of 5.10.1. Promote transport and other infrastructure that is environmentally friendly through proper site selection, choice of technology, and the application of conservation measures along and within the 5.10.2. Encourage the use of less polluting technologies in all sectors.",0.428454415704905,n
1751,8119," finances systems for generating, allocating and controlling finances for sfm. this includes means to access, create, participate in, and sustain markets for goods and services.",National forestry program,,24,en,"Finances systems for generating, allocating and controlling finances for sfm. This includes means to access, create, participate in, and sustain markets for goods and services.",0.4885587524138211,i
1761,7316,"in addition to these main groups of role players in malawi, the donor agencies and other organisations making up the international community represents a fifth group with important roles to play. the main role for this group is to support the government of malawis agreed priorities for improving forestry and livelihoods, to develop a co ordinated sector wide approach to provision of support for these priorities, and to work with the other four groups to ensure integration with international agreements and the global services which forests can provide.",National forestry program,,29,en,"In addition to these main groups of role players in malawi, the donor agencies and other organisations making up the international community represents a fifth group with important roles to play. The main role for this group is to support the government of malawis agreed priorities for improving forestry and livelihoods, to develop a co-ordinated sector-wide approach to provision of support for these priorities, and to work with the other four groups to ensure integration with international agreements and the global services which forests can provide.",0.415707186553032,i
1764,15117,"provision of guidance in accordance with national standards for forest management licensing of the import and export of forest products, activities within forest reserves lead responsibility to make enabling investment rules and procedures, and foster partnerships lead responsibility for customary land not covered by a management agreement. otherwise a monitoring role scrutiny of investment proposals, possible brokering of investments and partnerships, and monitoring of cross border trade contributor through implementing, and monitoring compliance of others, in management agreements companies or consultancies may be contracted to provide training lead responsibility to develop investments, partnerships and associations for market research and promotion ngos and communities may contribute to monitoring village institutions may licence activities within a fa covered by a management agreement ngos may provide training, particularly in participatory approaches ngos may support enterprise development, brokering and monitoring of partnerships and investments roles are not the same as job descriptions. whilst job descriptions are highly specific, handed out and often cast in stone, roles are more dynamic, requiring interpretation and development by the roleplayer. roles evolve and become more effective over time as role players discover new opportunities and dimensions in them. to play a role well the role player needs to identify with it, and work towards owning it. thus, the roles and their attendant responsibilities outlined in table 2 need to be steadily internalised through pursuit of strategies and practical actions. these strategies and actions are the subject of section 4.",National forestry program,,32,en,"Provision of guidance in accordance with national standards for forest management licensing of the import and export of forest products, activities within forest reserves lead responsibility to make enabling investment rules and procedures, and foster partnerships lead responsibility for customary land not covered by a management agreement. Otherwise a monitoring role scrutiny of investment proposals, possible brokering of investments and partnerships, and monitoring of cross-border trade contributor through implementing, and monitoring compliance of others, in management agreements companies or consultancies may be contracted to provide training lead responsibility to develop investments, partnerships and associations for market research and promotion ngos and communities may contribute to monitoring village institutions may licence activities within a fa covered by a management agreement ngos may provide training, particularly in participatory approaches ngos may support enterprise development, brokering and monitoring of partnerships and investments roles are not the same as job-descriptions. Whilst job-descriptions are highly specific, handed out and often cast in stone, roles are more dynamic, requiring interpretation and development by the roleplayer. Roles evolve and become more effective over time as role players discover new opportunities and dimensions in them. To play a role well the role-player needs to identify with it, and work towards owning it. Thus, the roles and their attendant responsibilities outlined in table 2 need to be steadily internalised through pursuit of strategies and practical actions. These strategies and actions are the subject of section 4.",0.427202428336415,n
1774,2534,"strategy to manage the process of institutional change develop and pursue shared vision and practical steps for building the human resources, structures, procedures and finance which can improve forestry and livelihoods.",National forestry program,,36,en,"Strategy to manage the process of institutional change develop and pursue shared vision and practical steps for building the human resources, structures, procedures and finance which can improve forestry and livelihoods.",0.423535589549127,i
1783,5123,"macro economic policies in malawi have turned away from the past development strategy, based on estate led growth, towards a strategy centred on poverty eradication, with the following main elements  smallholder agriculture as the main focus  private sector promotion and competitive markets rather than pastorals and excessive regulation  macroeconomic stability and a competitive exchange rate  expenditure focused on social services and safety net programmes which benefit the poor  instilling the spirit of poverty consciousness in planners and introducing a system of poverty these elements are addressed through policy instruments at the disposal of government which include  taxation, regulation of capital flows, banking and borrowing regulations  budget allocation  investment rules  rules of business incorporation and registration, investment promotion, industrial free zones and export processing zones  market liberalisation, pricing, exchange rates and interest rates  government structural reform, including restructuring state enterprises and decentralisation.",National forestry program,,39,en,"Macro economic policies in malawi have turned away from the past development strategy, based on estate-led growth, towards a strategy centred on poverty eradication, with the following main elements  smallholder agriculture as the main focus  private sector promotion and competitive markets rather than pastorals and excessive regulation  macroeconomic stability and a competitive exchange rate  expenditure focused on social services and safety net programmes which benefit the poor  instilling the spirit of poverty consciousness in planners and introducing a system of poverty these elements are addressed through policy instruments at the disposal of government which include  taxation, regulation of capital flows, banking and borrowing regulations  budget allocation  investment rules  rules of business incorporation and registration, investment promotion, industrial free zones and export processing zones  market liberalisation, pricing, exchange rates and interest rates  government structural reform, including restructuring state enterprises and decentralisation.",0.42859707739365005,i
1813,21215,"strategy to strengthen forest extension deliver appropriate extension and advisory services to farmers and small estates, based on sound technical packages, including agroforestry and woodlots, capable of adaptation to meet client needs.",National forestry program,,48,en,"Strategy to strengthen forest extension deliver appropriate extension and advisory services to farmers and small estates, based on sound technical packages, including agroforestry and woodlots, capable of adaptation to meet client needs.",0.401529597139899,n
1838,5182,"it has been suggested for a number of years that greater involvement of the private sector might improve this situation, and the treasury has asked for ownership and management options for these state owned plantations to be developed. yet there is inadequate capability within the department of forestry to develop sound concession agreements, monitor their performance and enforce penalties in case of breach of contract.",National forestry program,,57,en,"It has been suggested for a number of years that greater involvement of the private sector might improve this situation, and the treasury has asked for ownership and management options for these state-owned plantations to be developed. Yet there is inadequate capability within the department of forestry to develop sound concession agreements, monitor their performance and enforce penalties in case of breach of contract.",0.412827926493104,d
1840,7123,"generate a firm political decision on the management and ownership of plantations strengthen fire management systems involving government, communities and private sector prior to full devolving of responsibility to private sector  see below by improving skills and infrastructure conduct supply side research on plantation resources, sustainable yield and employment levels in the commercial plantation sector develop management plans for potentially viable plantation units conduct demand side research on existing wood using industries and enterprises wood fibre flows, and price and cost analysis, and malawis comparative advantages in the forest industry establish a contracting and leasing unit clew in the forestry department and build capability to learn lessons from plantation management and to develop, manage and monitor performance of contracts and leases.",National forestry program,,58,en,"Generate a firm political decision on the management and ownership of plantations strengthen fire-management systems involving government, communities and private sector prior to full devolving of responsibility to private sector  see below by improving skills and infrastructure conduct supply-side research on plantation resources, sustainable yield and employment levels in the commercial plantation sector develop management plans for potentially viable plantation units conduct demand-side research on existing wood using industries and enterprises wood fibre flows, and price and cost analysis, and malawis comparative advantages in the forest industry establish a contracting and leasing unit clew in the forestry department and build capability to learn lessons from plantation management and to develop, manage and monitor performance of contracts and leases.",0.4282464784878329,n
1851,7143,"the nfp has developed twelve strategies, each with a set of prioritised actions. in summary these strategies and actions aim to ensure that the role players are able to 1. manage the process of institutional change. re shape the forestry department organisational structures and procedures for managing human resource development, information, finance and planning.",National forestry program,,6,en,"The NFP has developed twelve strategies, each with a set of prioritised actions. In summary these strategies and actions aim to ensure that the role-players are able to 1. Manage the process of institutional change. Re-shape the forestry department organisational structures and procedures for managing human resource development, information, finance and planning.",0.40104771528304295,n
1859,1195,"4.1 2 develop forest sector financing paying for good forest management is a major challenge and any solution requires an exploration of options for improving government, private sector, donor, no and community level financial flows and mechanisms. in malawi, as in other countries faced with shrinking central government budgets, improving financing requires particular attention to raising the efficiency of existing financial flows, as well as searching for new investment in forestry by sector based public sector and non governmental actors. potential approaches to achieving these dual goals are discussed below.",National forestry program,,61,en,"4.12 develop forest sector financing paying for good forest management is a major challenge and any solution requires an exploration of options for improving government, private sector, donor, no and community-level financial flows and mechanisms. In malawi, as in other countries faced with shrinking central government budgets, improving financing requires particular attention to raising the efficiency of existing financial flows, as well as searching for new investment in forestry by sector-based public sector and non-governmental actors. Potential approaches to achieving these dual goals are discussed below.",0.486478950817265,i
1860,2234,"the government, mainly through the fd, has traditionally been the principle body responsible for investment in the forest resource for the provision of raw material for industry and communities. while the fd has always generated revenue from a range of sources, most notably from the sale of forest produce, until recently this revenue has been returned to the government. fd activities have thus been financed through ministry of finance mod recurrent and development budget allocations, including a significant contribution by donors.",National forestry program,,61,en,"The government, mainly through the fd, has traditionally been the principle body responsible for investment in the forest resource for the provision of raw material for industry and communities. While the FD has always generated revenue from a range of sources, most notably from the sale of forest produce, until recently this revenue has been returned to the government. Fd activities have thus been financed through ministry of finance mod recurrent and development budget allocations, including a significant contribution by donors.",0.443201440003427,i
1861,3192,"pressures to cut budgets have led to significant reductions in mod funding to the forestry sector, particularly since 199 2. while reduced government funding has been a predominant feature of forestry financing in malawi, recent reforms illustrate clear efforts to counteract the decline in finance by increasing private sector, community and no participation in forest management. in addition, the government in november 199 9 approved the conversationalist of a forest management and development fund fmdf, which aims to ease funding constraints for specific activities e.g., fire prevention and community forestry development by permitting the fd to retain 8 0 per cent of the revenue it generates. in addition, the fm should provide incentives to the fd to raise efficiency and revenue collection. some of the more innovative measures aimed at increasing non governmental finance include the promotion of trusts, decentralisation of forest management in village areas to village natural resource committees, and the development of proposals for a watershed protection levy.",National forestry program,,61,en,"Pressures to cut budgets have led to significant reductions in mod funding to the forestry sector, particularly since 1992. While reduced government funding has been a predominant feature of forestry financing in malawi, recent reforms illustrate clear efforts to counteract the decline in finance by increasing private sector, community and no participation in forest management. In addition, the government in november 1999 approved the conversationalist of a forest management and development fund fmdf, which aims to ease funding constraints for specific activities e.g., fire prevention and community forestry development by permitting the FD to retain 80 per cent of the revenue it generates. In addition, the FM should provide incentives to the FD to raise efficiency and revenue collection. Some of the more innovative measures aimed at increasing non-governmental finance include the promotion of trusts, decentralisation of forest management in village areas to village natural resource committees, and the development of proposals for a watershed protection levy.",0.48388548091518,i
1862,1203,"donors are being squeezed by their governments, which is having knock on effects for malawi. as their budgets shrink they, like the government, are trying to improve their performance. initiatives include increasing their co ordination with other donors, and decentralising finance towards lower levels of government, ngos and cbos.",National forestry program,,62,en,"Donors are being squeezed by their governments, which is having knock on effects for malawi. As their budgets shrink they, like the government, are trying to improve their performance. Initiatives include increasing their co-ordination with other donors, and decentralising finance towards lower levels of government, ngos and cbos.",0.424380790106882,d
1863,2244,"since ngos depend on donor finance, their financial position reflects changes in donor strategies. as noted above although donor funds are falling in total, they are reallocating more of their budgets towards ngos. those ngos which display adequate capacity to manage more funds are playing a growing role in financing forestry projects in the field.",National forestry program,,62,en,"Since ngos depend on donor finance, their financial position reflects changes in donor strategies. As noted above although donor funds are falling in total, they are reallocating more of their budgets towards ngos. Those ngos which display adequate capacity to manage more funds are playing a growing role in financing forestry projects in the field.",0.501850656187424,i
1864,3202," increasing responsibility being given to local cobs and ngos dependent in the short and medium term on external resources;  unbalanced distribution of external funding depending more on donor than national priorities strategy to develop forest sector financing increase government revenue and private, donor and civil society investment in forestry and develop a stronger match between financial resources and the priorities for improving forestry and livelihoods.",National forestry program,,63,en,"Increasing responsibility being given to local cobs and ngos dependent in the short and medium term on external resources;  unbalanced distribution of external funding depending more on donor than national priorities strategy to develop forest sector financing increase government revenue and private, donor and civil society investment in forestry and develop a stronger match between financial resources and the priorities for improving forestry and livelihoods.",0.47495578581967296,i
1877,1258," plan and implement better departmental systems for human resource development, information, finance, and planning and process management in support of on the ground action.",National forestry program,,66,en,"Plan and implement better departmental systems for human resource development, information, finance, and planning and process management in support of on-the-ground action.",0.413586930472692,n
1879,3229," generate the alliances and proposals for the support necessary for effective decentralised systems of human resource development, participation, information, finance, and planning.",National forestry program,,67,en,"Generate the alliances and proposals for the support necessary for effective decentralised systems of human resource development, participation, information, finance, and planning.",0.482268521093713,n
1880,4162,"private sector  engage with the fd and other role players to identify and overcome the policy, procedural, and finance blockages and the security constraints to investment in sustainable forestry enterprise.",National forestry program,,67,en,"Private sector  engage with the FD and other role-players to identify and overcome the policy, procedural, and finance blockages and the security constraints to investment in sustainable forestry enterprise.",0.44247343658147403,i
1881,6162," strengthen mechanisms that promote new investment, forest production and trade, and develop the information, personnel, finance and enterprise management systems needed to play the new private sector roles spelled out in this nfp document.",National forestry program,,67,en,"Strengthen mechanisms that promote new investment, forest production and trade, and develop the information, personnel, finance and enterprise management systems needed to play the new private sector roles spelled out in this NFP document.",0.494876150788185,i
1882,7172,"civil society  identify the community based institutions that have capability and motivation to improve the contribution that sustainable use of forest goods and services can make to livelihoods, and harness the nfp to support the work of these institutions.",National forestry program,,67,en,"Civil society  identify the community-based institutions that have capability and motivation to improve the contribution that sustainable use of forest goods and services can make to livelihoods, and harness the NFP to support the work of these institutions.",0.423277305866198,n
1884,111110,"international community including donor agencies  enter into dialogue with other role players for supporting the main priority actions identified in the  work with the other role players to establish milestones on the way to sector wide support for the nfp, including support for trust funds to increase efficiency, sustainability and volume of finance for forestry and livelihoods.",National forestry program,,67,en,"International community including donor agencies  enter into dialogue with other role-players for supporting the main priority actions identified in the  work with the other role-players to establish milestones on the way to sector-wide support for the nfp, including support for trust funds to increase efficiency, sustainability and volume of finance for forestry and livelihoods.",0.48193405691907704,i
1894,984,"1 2. develop forest sector financing. develop partnerships and co financing agreements between government, private sector and civil society for new forestry investments.",National forestry program,,7,en,"12. Develop forest sector financing. Develop partnerships and co-financing agreements between government, private sector and civil society for new forestry investments.",0.603700700332261,i
