,Unnamed: 0,sentences,name,country,page,languages,legible,results,class
1042,1092,"improving regulatory framework  review mandate of the regulator  review and enforce adherence to ict regulations, standards and guidelines developing public online services.  implement the hybrid mail system for the postal sector  build capacity in the provision of public online services  promote the provision of health, agriculture and education informative messages through sass provide internet connectivity to public institutions including social facilities  operationalize government data centres promoting community ict and multipurpose information centre. ",Malawi Growth and Development Strategy III ,,143,en,"Improving regulatory framework  review mandate of the regulator  review and enforce adherence to ict regulations, standards and guidelines developing public online services.  Implement the hybrid mail system for the postal sector  build capacity in the provision of public online services  promote the provision of health, agriculture and education informative messages through sass provide internet connectivity to public institutions including social facilities  operationalize government data centres promoting community ict and multipurpose information centre.",0.413121236097475,n
1044,354," promote mainstreaming of ict in sector policies, strategies and operations. ",Malawi Growth and Development Strategy III ,,143,en,"Promote mainstreaming of ict in sector policies, strategies and operations.",0.41267950347041205,n
1054,299,expanding user fees and insurance  develop and implement a health financing policy mph ,Malawi Growth and Development Strategy III ,,147,en,Expanding user fees and insurance  develop and implement a health financing policy MPH,0.41417577272981604,n
1055,6132," institutionalize national health accounts to provide evidence about sources, uses, and expenditure  introduce an affordable national health insurance scheme  reform hospital operations with the aim of increasing their autonomy, making them public trust hospitals ",Malawi Growth and Development Strategy III ,,148,en,"Institutionalize national health accounts to provide evidence about sources, uses, and expenditure  introduce an affordable national health insurance scheme  reform hospital operations with the aim of increasing their autonomy, making them public trust hospitals",0.41068052942332295,n
1074,1791," leverage government payments to provide scale especially for rural areas supporting the enabling regulatory framework  develop payment systems regulations mof, mra, banks, increased savings and investment opportunities leveraging savings groups by exploring partnerships with formal financial service providers  link savings groups to the formal system formalise savings, graduation path, security  capacity support to savings group members in income generating activities etc introducing voluntary personal pension targeting both formal and improving product development by service providers to make them relevant to the low income people  product development for targeted savings products e.g. saving wallets ",Malawi Growth and Development Strategy III ,,155,en,"Leverage government payments to provide scale especially for rural areas supporting the enabling regulatory framework  develop payment systems regulations mof, mra, banks, increased savings and investment opportunities leveraging savings groups by exploring partnerships with formal financial service providers  link savings groups to the formal system formalise savings, graduation path, security  capacity support to savings group members in income generating activities etc introducing voluntary personal pension targeting both formal and improving product development by service providers to make them relevant to the low income people  product development for targeted savings products e.g. Saving wallets",0.531150233370506,i
1076,6142,"penetration to mitigate developing and implementing a strategy for the insurance sector to ensure sustainable growth of key  formulate insurance sector strategy mof, rm ",Malawi Growth and Development Strategy III ,,156,en,"Penetration to mitigate developing and implementing a strategy for the insurance sector to ensure sustainable growth of key  formulate insurance sector strategy mof, RM",0.483784386934226,n
1109,484, develop and implement environmental standards for environment and natural resource sector initiatives in environmental and  enforce implementation of climate change investment plan and strategic plan for monroe ,Malawi Growth and Development Strategy III ,,168,en,Develop and implement environmental standards for environment and natural resource sector initiatives in environmental and  enforce implementation of climate change investment plan and strategic plan for monroe,0.427356070856445,i
1145,15211, promoting infrastructure investments for large scale irrigation schemes. ,Malawi Growth and Development Strategy III ,,179,en,Promoting infrastructure investments for large scale irrigation schemes.,0.427817703718236,i
1156,2315,"the mgds iii therefore, focuses on improved access to reliable and sustainable energy supply and investment in affordable alternative sources of energy. the strategy also emphasises enhanced use of renewable and clean energy in the underserved rural and urban communities. with respect to industrialisation mgds iii focuses on improved environment for investment and private sector development, increased production and export of manufactured products and enhanced production and sound management of non renewable resources. for tourism, the emphasis is on improved investments in tourism infrastructure improved quality of tourism products and services and improved conservation and management of cultural heritage resources. ",Malawi Growth and Development Strategy III ,,18,en,"The MGDS iii therefore, focuses on improved access to reliable and sustainable energy supply and investment in affordable alternative sources of energy. The strategy also emphasises enhanced use of renewable and clean energy in the underserved rural and urban communities. With respect to industrialisation MGDS iii focuses on improved environment for investment and private sector development, increased production and export of manufactured products and enhanced production and sound management of non-renewable resources. For tourism, the emphasis is on improved investments in tourism infrastructure improved quality of tourism products and services and improved conservation and management of cultural heritage resources.",0.4275532388513739,i
1161,2414," promoting access to finance for women, youth and vulnerable groups in agriculture. ",Malawi Growth and Development Strategy III ,,180,en,"Promoting access to finance for women, youth and vulnerable groups in agriculture.",0.44808003402403995,i
1180,406,institutionalising public private partnership opp in higher education. ,Malawi Growth and Development Strategy III ,,182,en,Institutionalising public-private partnership opp in higher education.,0.41021194343201706,n
1190,474,addressing barriers to investment for both local and foreign investment. ,Malawi Growth and Development Strategy III ,,183,en,Addressing barriers to investment for both local and foreign investment.,0.509044463765298,i
1195,2014,increased private sector investment in the operation and management of transport infrastructure. ,Malawi Growth and Development Strategy III ,,185,en,Increased private sector investment in the operation and management of transport infrastructure.,0.47801011465182,i
1196,2317,mobilising private businesses to engage in transportation sector to improve competition. ,Malawi Growth and Development Strategy III ,,185,en,Mobilising private businesses to engage in transportation sector to improve competition.,0.470236754358999,n
1202,461,increased stock of ict skilled and industry ready workforce in public and private sector institutions. ,Malawi Growth and Development Strategy III ,,185,en,Increased stock of ict skilled and industry ready workforce in public and private sector institutions.,0.405846374440101,n
1215,15101, supporting the enabling regulatory increased savings and investment leveraging savings groups by exploring partnerships with formal financial service providers introducing voluntary personal pension targeting both formal and informal sector improving product development by service providers to make them relevant to the low income people and memes facilitate issuance of long term debt instruments by the government and other public institutions and the private increased access to credit targeting farmers and other memes creating an enabling infrastructure 90 5 83 0 100 8 80 0 154 0 508 3 ,Malawi Growth and Development Strategy III ,,188,en,Supporting the enabling regulatory increased savings and investment leveraging savings groups by exploring partnerships with formal financial service providers introducing voluntary personal pension targeting both formal and informal sector improving product development by service providers to make them relevant to the low income people and memes facilitate issuance of long term debt instruments by the government and other public institutions and the private increased access to credit targeting farmers and other memes creating an enabling infrastructure 905 830 1008 800 1540 5083,0.5465997352841161,i
1240,1024,"the mgds iii has been developed through a process that allows all stakeholders to participate in the development of the country. its implementation will, therefore, also involve all stakeholders, including the three arms of government the executive, parliament, and judiciary; and civil society and faith based organizations fbos; private sector and the general public. government will lead the implementation process through technical coordination and its consolidated national budget. it is expected that all stakeholders including the private sector, civil society organisations csos, development and cooperating partners will continue to align their activities and support to the mgds iii. the institution responsible for national planning and development will facilitate and ensure that all mads align their sectoral plans, activities and budgets to the development strategy. ",Malawi Growth and Development Strategy III ,,21,en,"The MGDS iii has been developed through a process that allows all stakeholders to participate in the development of the country. Its implementation will, therefore, also involve all stakeholders, including the three arms of government the executive, parliament, and judiciary; and civil society and faith based organizations fbos; private sector and the general public. Government will lead the implementation process through technical coordination and its consolidated national budget. It is expected that all stakeholders including the private sector, civil society organisations csos, development and cooperating partners will continue to align their activities and support to the MGDS iii. The institution responsible for national planning and development will facilitate and ensure that all mads align their sectoral plans, activities and budgets to the development strategy.",0.4616763240843689,n
1305,2522,"the formulation of the mgds ii assumed that resources for its implementation would come from national budget as well as the development partners and other players such as private sector organizations. a year inside the strategy implementation, several development partners pulled out support from the national budget due to misuse of public financial resources. this affected the implementation of some of the activities that were planned over the years. ",Malawi Growth and Development Strategy III ,,39,en,"The formulation of the MGDS ii assumed that resources for its implementation would come from national budget as well as the development partners and other players such as private sector organizations. A year inside the strategy implementation, several development partners pulled out support from the national budget due to misuse of public financial resources. This affected the implementation of some of the activities that were planned over the years.",0.400162433904188,d
1306,1129,"framework for financing sustainable development by aligning all financing flows and policies with economic, social and environmental priorities. it is expected, therefore, that support will be directed to national priorities as set out in this strategy for purposes of achieving sustainable development goals at both local and national level. this will, in turn, facilitate the attainment of pairs declaration virtues of 200 5, which are ownership, alignment, harmonisation, development results and mutual accountability. ",Malawi Growth and Development Strategy III ,,40,en,"Framework for financing sustainable development by aligning all financing flows and policies with economic, social and environmental priorities. It is expected, therefore, that support will be directed to national priorities as set out in this strategy for purposes of achieving sustainable development goals at both local and national level. This will, in turn, facilitate the attainment of pairs declaration virtues of 2005, which are ownership, alignment, harmonisation, development results and mutual accountability.",0.43961035929697206,i
1307,1027,"although development partners have reduced direct budget support to the national budget, it is observed that they continue to contribute a large part of resources into the key sectors such as natural resources. this is evidenced by the public expenditure review per in the natural resources sector, done in 201 4, which showed that development partners contributed over 9 0 percent of resources allocated to the sector. even though the impact on the malawian population is seemingly not visible, development partners continue to support various sectors off budget. further, the development partners continue to provide technical support to various sectors such that capacities have been built to improve service delivery. withstanding this, resumption of budget support would go a long way in enhancing aid effectiveness. ",Malawi Growth and Development Strategy III ,,40,en,"Although development partners have reduced direct budget support to the national budget, it is observed that they continue to contribute a large part of resources into the key sectors such as natural resources. This is evidenced by the public expenditure review per in the natural resources sector, done in 2014, which showed that development partners contributed over 90 percent of resources allocated to the sector. Even though the impact on the malawian population is seemingly not visible, development partners continue to support various sectors off-budget. Further, the development partners continue to provide technical support to various sectors such that capacities have been built to improve service delivery. Withstanding this, resumption of budget support would go a long way in enhancing aid effectiveness.",0.42091738119204497,i
1311,1028,"and unsustainable. this has made services insufficiently and poorly delivered to the malawis economic development has also slowed down due to poor environment for doing business. the 201 7 doing business report of the world, ranked malawi at 13 3 out of 19 0 countries, a slight improvement from the rank of 14 1 in 201 6. in this report countries are assessed based on several factors that affect business decisions. these include starting a business; access to electricity; registering property; getting credit; protecting investors; paying taxes; trading across borders; and enforcing contracts and resolving insolvency. malawi has not been ranked favorably in many of these indicators and there are still gaps that the underdeveloped financial sector has made investment in real sectors a challenge. in terms of financial sector soundness, malawi is doing well having suffered only one bank failure over the past two decades. however, when it comes to supporting investment, the financial sector has been fragile as all the financial institutions created to support local investment have folded up after short operational periods due to a multiplicity of other challenges. on the contrary, banking is very profitable not from developmental lending operations, but from investing in government securities. ",Malawi Growth and Development Strategy III ,,42,en,"And unsustainable. This has made services insufficiently and poorly delivered to the malawis economic development has also slowed down due to poor environment for doing business. The 2017 doing business report of the world, ranked malawi at 133 out of 190 countries, a slight improvement from the rank of 141 in 2016. In this report countries are assessed based on several factors that affect business decisions. These include starting a business; access to electricity; registering property; getting credit; protecting investors; paying taxes; trading across borders; and enforcing contracts and resolving insolvency. Malawi has not been ranked favorably in many of these indicators and there are still gaps that the underdeveloped financial sector has made investment in real sectors a challenge. In terms of financial sector soundness, malawi is doing well having suffered only one bank failure over the past two decades. However, when it comes to supporting investment, the financial sector has been fragile as all the financial institutions created to support local investment have folded up after short operational periods due to a multiplicity of other challenges. On the contrary, banking is very profitable not from developmental lending operations, but from investing in government securities.",0.4482022454517461,d
1325,13221,"an effort will also be made towards improved procurement in public institutions. the department responsible for procurement of public goods and services, and all other relevant institutions, will receive support for capacity building and strengthening so that they are able to execute their mandate efficiently and effectively to improve competitiveness and reduce losses, and non delivery. national procurement act will be enforced to ensure quality goods and services are procured, delivered and distributed accordingly to various points. ",Malawi Growth and Development Strategy III ,,45,en,"An effort will also be made towards improved procurement in public institutions. The department responsible for procurement of public goods and services, and all other relevant institutions, will receive support for capacity building and strengthening so that they are able to execute their mandate efficiently and effectively to improve competitiveness and reduce losses, and non-delivery. National procurement act will be enforced to ensure quality goods and services are procured, delivered and distributed accordingly to various points.",0.416636610846711,n
1331,2620,"given that pf reforms are often cross cutting, there is need to enhance coordination amongst the various implementing agents to facilitate smooth implementation. all key implementing institutions require internal capacity for implementation that should be augmented by the coordinating institution. for the governance structures to be effective, there is need to strengthen the pf unit in the mofepd which serves as the secretariat through various endeavours including functional review, reforms assessments and capacity building. ",Malawi Growth and Development Strategy III ,,48,en,"Given that PF reforms are often cross-cutting, there is need to enhance coordination amongst the various implementing agents to facilitate smooth implementation. All key implementing institutions require internal capacity for implementation that should be augmented by the coordinating institution. For the governance structures to be effective, there is need to strengthen the PF unit in the mofepd which serves as the secretariat through various endeavours including functional review, reforms assessments and capacity building.",0.4071259538207489,n
1332,7201,"service providers or traders and based on their sources of funds as wholly sub vented, all these pastorals need to be well managed so that they benefit the general public but also be able to remit dividends to government as required. during the mgds iii implementation, this will require effective implementation of the policy so that the dividends from the pastorals benefit the economy. this will be done by reviewing and developing performance management plans and budgets bpm and developing database for all the public and private investment corporations. ",Malawi Growth and Development Strategy III ,,49,en,"Service providers or traders and based on their sources of funds as wholly sub-vented, all these pastorals need to be well managed so that they benefit the general public but also be able to remit dividends to government as required. During the MGDS iii implementation, this will require effective implementation of the policy so that the dividends from the pastorals benefit the economy. This will be done by reviewing and developing performance management plans and budgets bpm and developing database for all the public and private investment corporations.",0.45756980488077903,n
1335,1424,"growth of expenditures for the past seven years has been on account of statutory expenditures such as wages and salaries, interest payments and amortization, pensions and gratuities and compensations. going forward, government policy will be to decelerate growth in these expenditure lines as one way of increasing fiscal space for investments in the flagship projects. for wages and salaries, growth in the wage bill will be within 1 0 to 1 5 percent by slowing recruitment and managing annual salary adjustments. for interest payments and amortization, government will minimize growth in arrears and domestic borrowing by among other things effecting the debt management policy more particularly the conversion of short debt term instruments to long term debt instruments. pensions and gratuity will gradually move to the contributory scheme so as to minimise the growth in the government will continue to focus on the policies aimed at expanding the revenue base and stimulating investment and economic activities in the implementation of the mgds iii. ",Malawi Growth and Development Strategy III ,,51,en,"Growth of expenditures for the past seven years has been on account of statutory expenditures such as wages and salaries, interest payments and amortization, pensions and gratuities and compensations. Going forward, government policy will be to decelerate growth in these expenditure lines as one way of increasing fiscal space for investments in the flagship projects. For wages and salaries, growth in the wage bill will be within 10 to 15 percent by slowing recruitment and managing annual salary adjustments. For interest payments and amortization, government will minimize growth in arrears and domestic borrowing by among other things effecting the debt management policy more particularly the conversion of short debt term instruments to long term debt instruments. Pensions and gratuity will gradually move to the contributory scheme so as to minimise the growth in the government will continue to focus on the policies aimed at expanding the revenue base and stimulating investment and economic activities in the implementation of the MGDS iii.",0.45334832310016104,i
1337,2715,these measures will eventually increase investment expenditure in the flagship projects identified in the priority areas. increased investment will ensure achieving quick wins during the medium term and setting the foundation for long term sustainability pathways. the identified flagship projects are expected to spur economic growth and development in the country through their multi dimensional and integrated design. government is also geared towards achieving fiscal prudence to reduce public resources slips by among other things improving on the public financial management. ,Malawi Growth and Development Strategy III ,,51,en,These measures will eventually increase investment expenditure in the flagship projects identified in the priority areas. Increased investment will ensure achieving quick wins during the medium term and setting the foundation for long-term sustainability pathways. The identified flagship projects are expected to spur economic growth and development in the country through their multi-dimensional and integrated design. Government is also geared towards achieving fiscal prudence to reduce public resources slips by among other things improving on the public financial management.,0.42813232030818393,i
1338,3410,"with the increasing emergence of private sector investors in the major growth sectors such as energy, water and communications, government policy will be to promote financing of flagship projects through public private partnership arrangements. however, in the initial year, the focus will be on developing bankable projects by undertaking feasibility studies in order to bring the projects to financial close for easy uptake by investors. ",Malawi Growth and Development Strategy III ,,51,en,"With the increasing emergence of private sector investors in the major growth sectors such as energy, water and communications, government policy will be to promote financing of flagship projects through public private partnership arrangements. However, in the initial year, the focus will be on developing bankable projects by undertaking feasibility studies in order to bring the projects to financial close for easy uptake by investors.",0.542026886445591,i
