,Unnamed: 0,sentences,name,country,page,languages,legible,results,class
2559,1694,"this report presents the results of the national forest landscape restoration assessment nflra for malawi. it aims to equip the government of malawi with a framework to address land degradation and deforestation, and to leverage both technical support and financing to implement flr at scale. ",ROAM for Malawi,,19,en,"This report presents the results of the national forest landscape restoration assessment nflra for malawi. It aims to equip the government of malawi with a framework to address land degradation and deforestation, and to leverage both technical support and financing to implement FLR at scale.",0.4631877763670871,n
2560,2492,"the nflra process was launched in february 201 6 by the minister of natural resources, energy and mining in close collaboration with government departments in the ministries of agriculture, water and irrigation, lands, local government, finance and economic planning, and gender and social services and other concerned stakeholders. the national assessment was designed to identify degraded and deforested land, and to prioritize intervention needs and opportunities for the restoration of the productivity and ecological function landscapes in malawi. ",ROAM for Malawi,,19,en,"The nflra process was launched in february 2016 by the minister of natural resources, energy and mining in close collaboration with government departments in the ministries of agriculture, water and irrigation, lands, local government, finance and economic planning, and gender and social services and other concerned stakeholders. The national assessment was designed to identify degraded and deforested land, and to prioritize intervention needs and opportunities for the restoration of the productivity and ecological function landscapes in malawi.",0.44161078181945795,n
2565,122110,"to guide the implementation of this nflra and to mobilize the necessary investments from the public and private sectors, malawi is preparing a national forest landscape restoration flr strategy. the strategy will present key findings and recommendations from the nflra to highlight restoration opportunities and priority areas for implementation, present a framework for priority interventions, and make the case for investing in flr implementation. it will highlight measures to enable and encourage malawians in civil society, the private sector, and government to restore degraded and deforested landscapes. ",ROAM for Malawi,,19,en,"To guide the implementation of this nflra and to mobilize the necessary investments from the public and private sectors, malawi is preparing a national forest landscape restoration FLR strategy. The strategy will present key findings and recommendations from the nflra to highlight restoration opportunities and priority areas for implementation, present a framework for priority interventions, and make the case for investing in FLR implementation. It will highlight measures to enable and encourage malawians in civil society, the private sector, and government to restore degraded and deforested landscapes.",0.417862477117956,i
2573,5173,"the main activities of the nflra process were organized from february to november 201 6 with technical and financial support from the usaidmalawi funded  project. additional assistance was provided by the world resources institute writ with support from bmz, and by the international union for the conservation of nature iucn with support from ukaid. ",ROAM for Malawi,,21,en,"The main activities of the nflra process were organized from february to november 2016 with technical and financial support from the usaidmalawi-funded  project. Additional assistance was provided by the world resources institute writ with support from bmz, and by the international union for the conservation of nature iucn with support from ukaid.",0.439031063490307,i
2618,6291,"policies and institutions working group members cited numerous agriculture, forest, and climate policies that could be better harmonized to create an enabling environment that fosters widespread adoption of restoration related agricultural technologies such as conservation agriculture and fmnr. landscape level governance will require the alignment and joint action of many institutions supported by appropriate and, where possible, progressive policies, laws, and regulations. the need to strengthen cross sectoral linkages and enhance policy coordination relevant to flr is reflected in the national agriculture policy 201 6, which is a 5 year guide for developing agricultural policies and strategies for sustainable agricultural production among other areas. ",ROAM for Malawi,,28,en,"Policies and institutions working group members cited numerous agriculture, forest, and climate policies that could be better harmonized to create an enabling environment that fosters widespread adoption of restoration-related agricultural technologies such as conservation agriculture and fmnr. Landscape-level governance will require the alignment and joint action of many institutions supported by appropriate and, where possible, progressive policies, laws, and regulations. The need to strengthen cross-sectoral linkages and enhance policy coordination relevant to FLR is reflected in the national agriculture policy 2016, which is a 5 year guide for developing agricultural policies and strategies for sustainable agricultural production among other areas.",0.40164323505704996,n
2620,2572,"the national climate change policy 201 5 includes a focus on adaptation and mitigation in the agriculture sector and can be a useful tool to drive large scale implementation of agricultural technologies. the policy advocates for integration of climate change strategies into agriculture programs, and emphasizes agroforestry as an important approach to boosting climate change resilience, increasing carbon storage, and strengthening food security and household income. the national climate change investment plan 201 3 also highlights agriculture as a key sector through which enhance climate change resilience, while malawis national adaptation programme of action 200 6 outlines agricultural interventions aimed at boosting womens resilience to climate change. ",ROAM for Malawi,,29,en,"The national climate change policy 2015 includes a focus on adaptation and mitigation in the agriculture sector and can be a useful tool to drive large-scale implementation of agricultural technologies. The policy advocates for integration of climate change strategies into agriculture programs, and emphasizes agroforestry as an important approach to boosting climate change resilience, increasing carbon storage, and strengthening food security and household income. The national climate change investment plan 2013 also highlights agriculture as a key sector through which enhance climate change resilience, while malawis national adaptation programme of action 2006 outlines agricultural interventions aimed at boosting womens resilience to climate change.",0.40328453685131105,n
2627,2591,"this is also an important metric because malawian households may not have the financial capital to make the necessary investments out of their own pockets and more importantly, they may also be unable to borrow the money because they lack access to credit markets manson 201 0. as of 201 0, less than 1 5 percent of all households in malawi had some interaction with the credit market and only 1.2 percent of households successfully obtained an agricultural loan. additionally, gender information from malawi shows that female headed households face more constraints to accessing credit than male headed households. large financial gaps will suggest that additional sources of funding will need to be secured and distributed to smallholders as part of a larger scaling up effort.",ROAM for Malawi,,31,en,"This is also an important metric because malawian households may not have the financial capital to make the necessary investments out of their own pockets and more importantly, they may also be unable to borrow the money because they lack access to credit markets manson 2010. As of 2010, less than 15 percent of all households in malawi had some interaction with the credit market and only 1.2 percent of households successfully obtained an agricultural loan. Additionally, gender information from malawi shows that female headed households face more constraints to accessing credit than male headed households. Large financial gaps will suggest that additional sources of funding will need to be secured and distributed to smallholders as part of a larger scaling-up effort.",0.437061726945777,d
2635,827,"though women contribute significantly to the forestry agricultural sector, they have limited access to, control over, and ownership of agriculture forest assets and capital such as land, credit, inputs and income. these gender gaps can be reduced by equipping stakeholders with knowledge and tools on gender responsive flr including via farm radio programmes and by ensuring full and active participation by women in training and capacity building programmes for flr implementation.",ROAM for Malawi,,32,en,"Though women contribute significantly to the forestry-agricultural sector, they have limited access to, control over, and ownership of agriculture-forest assets and capital such as land, credit, inputs and income. These gender gaps can be reduced by equipping stakeholders with knowledge and tools on gender responsive FLR including via farm radio programmes and by ensuring full and active participation by women in training and capacity building programmes for FLR implementation.",0.4194020700552971,n
2641,1802,"effective protection and assistance of natural regeneration. community user groups, especially women and local entrepreneurs can be encouraged and assisted to establish and manage woodlots as economically viable businesses organized to produce a steady supply of forest products. increased technical support must also be mobilized to assist with site and species selection, seed supply, site preparation and tree planting, and sustained yield management and regeneration. assistance with increased local investments in establishing and managing community forests and woodlots should also be complemented with small grants and technical support to strengthen associated forest product value chains and to reinforce the economic returns and incentives for communities and user groups to invest in these restoration interventions. this could include assistance with the development of bee keeping and honey production, and value added processing and marketing of a range timber and non timber forest products from community forests and woodlots.",ROAM for Malawi,,35,en,"Effective protection and assistance of natural regeneration. Community user groups, especially women and local entrepreneurs can be encouraged and assisted to establish and manage woodlots as economically viable businesses organized to produce a steady supply of forest products. Increased technical support must also be mobilized to assist with site and species selection, seed supply, site preparation and tree-planting, and sustained yield management and regeneration. Assistance with increased local investments in establishing and managing community forests and woodlots should also be complemented with small grants and technical support to strengthen associated forest product value chains and to reinforce the economic returns and incentives for communities and user groups to invest in these restoration interventions. This could include assistance with the development of bee-keeping and honey production, and value added processing and marketing of a range timber and non-timber forest products from community forests and woodlots.",0.403660672750995,i
2678,9222,"the focus should be on increased institutional effectiveness for policy and law implementation as this has been an area of weakness. this will include the full involvement of sat including capacity building training and financial support, the incentive's of adjacent communities through mechanisms such as vela and cecf, sustained by large scale investment opportunities, for example through the dedicated grant mechanism under the world bank forest investment programme and the green climate fund.",ROAM for Malawi,,40,en,"The focus should be on increased institutional effectiveness for policy and law implementation as this has been an area of weakness. This will include the full involvement of sat including capacity building training and financial support, the incentive's of adjacent communities through mechanisms such as vela and cecf, sustained by large scale investment opportunities, for example through the dedicated grant mechanism under the world bank forest investment programme and the green climate fund.",0.48098540035355397,i
2769,2836,"the five scalable flr interventions agricultural technologies, soil and water conservation, forest management, river and stream bank restoration, community forests and woodlots that have been identified, can be implemented with specific attention paid to the severity and type of degradation in these areas, and the contributions landscape restoration can make to food security, resilience, and biodiversity. this can be integrated into district planning, and can unlock different types of financing for restoration.",ROAM for Malawi,,63,en,"The five scalable FLR interventions agricultural technologies, soil and water conservation, forest management, river and stream-bank restoration, community forests and woodlots that have been identified, can be implemented with specific attention paid to the severity and type of degradation in these areas, and the contributions landscape restoration can make to food security, resilience, and biodiversity. This can be integrated into district planning, and can unlock different types of financing for restoration.",0.41012560759163297,n
2787,9261,"department of forestry the national forest policy 201 6, forest act 199 7 and the national forest programme 200 1 are housed at the department of forestry. the national forest policy 201 6 focuses on sustainable management of forestry resources for the enhancement of life of all malawians, was indicated to be very pertinent to flr because it promotes both afforestation and re afforestation, regeneration and agricultural technology ca, fmnr, af practices. the provisions on community based forest management and biomass energy, industrial plantation management and financing mechanism can particularly support the flr implementation. the weak protection of the river banks and the ongoing cultivation of marginal areas were identified as barriers for flr. ",ROAM for Malawi,,68,en,"Department of forestry the national forest policy 2016, forest act 1997 and the national forest programme 2001 are housed at the department of forestry. The national forest policy 2016 focuses on sustainable management of forestry resources for the enhancement of life of all malawians, was indicated to be very pertinent to FLR because it promotes both afforestation and re-afforestation, regeneration and agricultural technology ca, fmnr, af practices. The provisions on community based forest management and biomass energy, industrial plantation management and financing mechanism can particularly support the FLR implementation. The weak protection of the river banks and the ongoing cultivation of marginal areas were identified as barriers for flr.",0.418419980742363,i
2794,836,"community institutions for finance a brief survey with dd annex 1 1 showed that there are institutions through which communities can save and borrow, but that especially borrowing options are limited, and mostly come from village savings and loans associations vsla5. in the absence of accessible borrowing mechanisms wage labour or piecework, commonly known as gangway in malawi, along with natural resources exploitation predominantly unsustainable charcoal making and fishing are key ways to access cash for emergencies. in terms of access to financial services, solidarity groups e.g. vsla, traditional rotating savings groups e.g. chilean or chiperegani, and money lenders are the commonest financial institutions at the community level and there is no access to formal banks and very little to cooperatives. gangway is a particularly important source of cash at the village level, a fact backed up by other studies whiteside, 200 0. there is generally an absence of financial institutions that directly support restoration at the village and district level. ",ROAM for Malawi,,69,en,"Community institutions for finance a brief survey with DD annex 11 showed that there are institutions through which communities can save and borrow, but that especially borrowing options are limited, and mostly come from village savings and loans associations vsla5. In the absence of accessible borrowing mechanisms wage labour or piecework, commonly known as gangway in malawi, along with natural resources exploitation predominantly unsustainable charcoal-making and fishing are key ways to access cash for emergencies. In terms of access to financial services, solidarity groups e.g. Vsla, traditional rotating savings groups e.g. Chilean or chiperegani, and money lenders are the commonest financial institutions at the community level and there is no access to formal banks and very little to cooperatives. Gangway is a particularly important source of cash at the village level, a fact backed up by other studies whiteside, 2000. There is generally an absence of financial institutions that directly support restoration at the village and district level.",0.465944663348353,d
2821,4451,"there are several ways to reduce the information barrier to promote more widespread adoption of restoration activities. a first step might be to increase investment in extension, outreach & knowledge sharing programs tailor made for women and men to reduce knowledge and skill barriers and promote adoption at largescale. the japanese international cooperation agency mica has piloted one approach to extension that others could learn from and expand across the country mica 201 6. the project, known as  ii, helps smallholders gain knowledge and skills with restoration activities in addition to developing their capacity to access the resources that are necessary to implement the activities. once a smallholder receives training that information can be passed on through farmer to farmer training. additionally, outreach activities, like farm radio programs, can also reduce information barriers by discussing the practical steps of implementing different restoration activities and highlighting the benefits that smallholders could expect to receive. ",ROAM for Malawi,,74,en,"There are several ways to reduce the information barrier to promote more widespread adoption of restoration activities. A first step might be to increase investment in extension, outreach & knowledge sharing programs tailor made for women and men to reduce knowledge and skill barriers and promote adoption at largescale. The japanese international cooperation agency mica has piloted one approach to extension that others could learn from and expand across the country mica 2016. The project, known as  ii, helps smallholders gain knowledge and skills with restoration activities in addition to developing their capacity to access the resources that are necessary to implement the activities. Once a smallholder receives training that information can be passed on through farmer-to-farmer training. Additionally, outreach activities, like farm radio programs, can also reduce information barriers by discussing the practical steps of implementing different restoration activities and highlighting the benefits that smallholders could expect to receive.",0.424191383016192,n
2825,11471,"up front financial costs are also greater for restoration interventions as compared to current land uses and this poses a problem for poor households who may not have the financial resources to make investments in restoration activities. according to the malawi integrated household survey of 201 0, less than 1 5 percent of all households in malawi had some interaction with the credit market and only 1.2 percent of households successfully obtained a loan manson 201 1. in addition, according to the his 3, women often lack access to credit from banks and microfinance institutions because of collateral and security guarantees ministry of gender, children, disability and social welfare 201 46. this suggests that households must either pay for the additional financial costs of adopting restoration activities from their own savings or additional sources of funding will have to be secured and distributed to smallholders across the country in the form of farm credit. ",ROAM for Malawi,,75,en,"Up-front financial costs are also greater for restoration interventions as compared to current land uses and this poses a problem for poor households who may not have the financial resources to make investments in restoration activities. According to the malawi integrated household survey of 2010, less than 15 percent of all households in malawi had some interaction with the credit market and only 1.2 percent of households successfully obtained a loan manson 2011. In addition, according to the his 3, women often lack access to credit from banks and microfinance institutions because of collateral and security guarantees ministry of gender, children, disability and social welfare 20146. This suggests that households must either pay for the additional financial costs of adopting restoration activities from their own savings or additional sources of funding will have to be secured and distributed to smallholders across the country in the form of farm credit.",0.4927160655911911,d
2826,2882,this discussion also raises the question of how malawi can raise the funds needed to make the necessary investment to fulfill its commitment to restore 4.5 million hectares of degraded land by 203 0. this discussion is addressed in the finance section of the report. ,ROAM for Malawi,,75,en,This discussion also raises the question of how malawi can raise the funds needed to make the necessary investment to fulfill its commitment to restore 4.5 million hectares of degraded land by 2030. This discussion is addressed in the finance section of the report.,0.407515620405714,i
2827,3661,"5.4 financing sources for restoration in malawi meeting malawis restoration commitment will require both private and public sector financing to fund different activities of its national restoration strategy. this will require innovative financing partnerships with both the private and public sectors, and importantly finding ways to incentivize smaller holder and community own investments in the restoration of their own lands. it will also require cross sector institutional coordination and bottom uptop down coordination of program implementation to scale up restoration successes. ",ROAM for Malawi,,75,en,"5.4 financing sources for restoration in malawi meeting malawis restoration commitment will require both private and public sector financing to fund different activities of its national restoration strategy. This will require innovative financing partnerships with both the private and public sectors, and importantly finding ways to incentivize smaller holder and community own investments in the restoration of their own lands. It will also require cross-sector institutional coordination and bottom-uptop-down coordination of program implementation to scale up restoration successes.",0.5563619459921559,i
2828,446,"the analysis of restoration costs in malawi allows us to estimate the gap between current finance in support of restoration activities and the level of finance needed to achieve malawis 4.5 million ha restoration target over the next thirteen years. the previous analysis suggested that restoring 4.5 million hectares of degraded land in malawi would cost at least 27 9 billion mwk or approximately 6 2,00 0 mwk per hectare. in this section, we will first discuss several types of financial resources from which funds can be raised to close the financing gap. this will include international, national and private sources. furthermore, we will review the existing financing mechanisms that can be used to pay for restoration activities in practice, and discuss the existing barriers for restoration finance in malawi. ",ROAM for Malawi,,75,en,"The analysis of restoration costs in malawi allows us to estimate the gap between current finance in support of restoration activities and the level of finance needed to achieve malawis 4.5 million ha restoration target over the next thirteen years. The previous analysis suggested that restoring 4.5 million hectares of degraded land in malawi would cost at least 279 billion MWK or approximately 62,000 MWK per hectare. In this section, we will first discuss several types of financial resources from which funds can be raised to close the financing gap. This will include international, national and private sources. Furthermore, we will review the existing financing mechanisms that can be used to pay for restoration activities in practice, and discuss the existing barriers for restoration finance in malawi.",0.481629729663914,i
