,Unnamed: 0,sentences,name,country,page,languages,legible,results,class
230,512,"8. an appropriation for the purposes of the national compensation fund shall be laid before the national assembly by the minister responsible for finance before the beginning, and with respect to, every financial year during the life of the fund.",Constituion,Constituion,61,en,"8. An appropriation for the purposes of the national compensation fund shall be laid before the national assembly by the minister responsible for finance before the beginning, and with respect to, every financial year during the life of the fund.",0.44732398049309796,i
243,513,"14 9. national local government finance committee, its establishment, powers and functions 1. there shall be a national local government finance committee which shall hear submissions from each and every local government authority in respect of estimates of expenditure and requests for special disbursements and shall have such other powers and functions as may be conferred on it by this constitution or an act of parliament.",Constituion,Constituion,63,en,"149. National local government finance committee, its establishment, powers and functions 1. There shall be a national local government finance committee which shall hear submissions from each and every local government authority in respect of estimates of expenditure and requests for special disbursements and shall have such other powers and functions as may be conferred on it by this constitution or an act of parliament.",0.414806524312367,i
293,1719,"all revenues or other moneys raised or received for the purposes of the government shall, subject to this constitution and any act of parliament, be paid into and form one fund, to be known as the consolidated fund.",Constituion,Constituion,74,en,"All revenues or other moneys raised or received for the purposes of the government shall, subject to this constitution and any act of parliament, be paid into and form one fund, to be known as the consolidated fund.",0.427366064027344,i
295,519,"2. where any moneys are charged by this constitution or by any act of parliament upon the consolidated fund, they shall be paid out of that fund by the minister responsible for finance to the person or authority to whom the payment is due.",Constituion,Constituion,75,en,"2. Where any moneys are charged by this constitution or by any act of parliament upon the consolidated fund, they shall be paid out of that fund by the minister responsible for finance to the person or authority to whom the payment is due.",0.46945800736198706,i
297,721,4. the investment of moneys forming part of the consolidated fund by way of deposit with a bank or such other secure investment as may be approved by the national assembly shall not be regarded as a withdrawal of those moneys from the consolidated fund for the purposes of this constitution.,Constituion,Constituion,75,en,4. The investment of moneys forming part of the consolidated fund by way of deposit with a bank or such other secure investment as may be approved by the national assembly shall not be regarded as a withdrawal of those moneys from the consolidated fund for the purposes of this constitution.,0.436153596918975,i
304,1517,"1. the national assembly may make provision for the establishment of a contingencies fund and for authorizing the minister responsible for finance, if he or she is satisfied that there has arisen an urgent and unforeseen need for expenditure for which no other provision exists, to make advances from that fund to meet that need.",Constituion,Constituion,77,en,"1. The national assembly may make provision for the establishment of a contingencies fund and for authorizing the minister responsible for finance, if he or she is satisfied that there has arisen an urgent and unforeseen need for expenditure for which no other provision exists, to make advances from that fund to meet that need.",0.418941947341049,i
306,425,18 0. raising of loans by the government 1. a loan may be raised by the government under the authority of an act of parliament and not otherwise.,Constituion,Constituion,78,en,180. Raising of loans by the government 1. A loan may be raised by the government under the authority of an act of parliament and not otherwise.,0.447287993569645,i
308,723,"1. an act of parliament may, subject to section 18 2, make provision for the creation of special funds which shall be accounted within the accounts of the consolidated fund and for the regulation or management of the moneys accounted in such special funds.",Constituion,Constituion,78,en,"1. An act of parliament may, subject to section 182, make provision for the creation of special funds which shall be accounted within the accounts of the consolidated fund and for the regulation or management of the moneys accounted in such special funds.",0.45614122207289703,i
311,1119,"1. there shall be a special fund within the consolidated fund to be known as the development fund in which shall be accounted receipts and expenditure of the government relating to the development of the republic, which have not been included in the annual statement provided for in section 17 5, and estimates of such receipts and expenditure shall be submitted by the minister responsible for finance to the national assembly not less than once a year.",Constituion,Constituion,78,en,"1. There shall be a special fund within the consolidated fund to be known as the development fund in which shall be accounted receipts and expenditure of the government relating to the development of the republic, which have not been included in the annual statement provided for in section 175, and estimates of such receipts and expenditure shall be submitted by the minister responsible for finance to the national assembly not less than once a year.",0.442573174989612,i
312,1216,"2. when the estimates of expenditure to be met from the development fund have been approved by the national assembly, a bill to be known as appropriation development fund bill shall be introduced in the national assembly providing for the issue from the development fund and appropriation of the sums necessary to meet that expenditure.",Constituion,Constituion,78,en,"2. When the estimates of expenditure to be met from the development fund have been approved by the national assembly, a bill to be known as appropriation development fund bill shall be introduced in the national assembly providing for the issue from the development fund and appropriation of the sums necessary to meet that expenditure.",0.42369838323516495,i
320,523,"1. there shall be established by an act of parliament a central bank of the republic, known as the reserve bank of malawi which shall serve as the states principal instrument for the control of money supply, currency and the institutions of finance and shall serve generally in accordance with the normal functions of a central bank.",Constituion,Constituion,80,en,"1. There shall be established by an act of parliament a central bank of the republic, known as the reserve bank of malawi which shall serve as the states principal instrument for the control of money supply, currency and the institutions of finance and shall serve generally in accordance with the normal functions of a central bank.",0.41828946301383896,i
453,1051,"5 5.if in any financial year the income of the fund together with any surplus income brought forward from a previous year, is insufficient to meet the actual or estimated liabilities of the fund, the minister responsible for finance may make advances to the fund in order to meet the deficiency or any part thereof and such advances shall be made on such teens and conditions, whether as to repayment or otherwise, as the minister responsible for finance may determine. ",Environment Management Act,,36,en,"55.if in any financial year the income of the fund together with any surplus income brought forward from a previous year, is insufficient to meet the actual or estimated liabilities of the fund, the minister responsible for finance may make advances to the fund in order to meet the deficiency or any part thereof and such advances shall be made on such teens and conditions, whether as to repayment or otherwise, as the minister responsible for finance may determine.",0.466571370609207,i
458,1441," any part of he fund not immediately requited for the purposes of the fund may, on the recommendation of the council, be invested in such manner as the minister, after consulting with he minister responsible for finance, may determine. ",Environment Management Act,,37,en,"Any part of he fund not immediately requited for the purposes of the fund may, on the recommendation of the council, be invested in such manner as the minister, after consulting with he minister responsible for finance, may determine.",0.4947890998202729,i
534,1737,"a such sums as shall be appropriated by parliament for the purpose of the fund;advances made to the fund under section 5 7;such sums as may be received for the purposes of the fund by way of voluntary contributions, levies from a metre cube of wood felled or extractedpayments made into the fund under section 1 2; andsuch sums or other assets may be donated for the purposes of the fund by any foreign government, international agency or foreign institution or body. ",– 1997,,22,en,"A such sums as shall be appropriated by parliament for the purpose of the fund;advances made to the fund under section 57;such sums as may be received for the purposes of the fund by way of voluntary contributions, levies from a metre cube of wood felled or extractedpayments made into the fund under section 12; andsuch sums or other assets may be donated for the purposes of the fund by any foreign government, international agency or foreign institution or body.",0.412403784966949,i
535,1181," whether as to repayment or otherwise, as the minister responsible for finance may determine. ",– 1997,,23,en,"Whether as to repayment or otherwise, as the minister responsible for finance may determine.",0.46502636270483205,n
542,21010,"2 any part of the fund not immediately required for the purposes of the fund may, on the recommendation of the board, be invested in such manner as the minister, after consulting with the minister responsible for finance, may determine. ",– 1997,,24,en,"2 any part of the fund not immediately required for the purposes of the fund may, on the recommendation of the board, be invested in such manner as the minister, after consulting with the minister responsible for finance, may determine.",0.49586825770867204,i
572,1052,"c to promote community involvement in the conservation of trees and forests in forest reserves and protected forest areas in accordance with the provisions of this act;to empower village natural resources management committees to source financial and technical assistance from the private sector, non governmental organisations and other organisations;to promote sustainable utilisation of timber, fuelwood and other forest produce;to promote optimal land use practices through agroforestry in smallholder farming systems;to update the capability of forestry institutions in the implementation of their resources management responsibilities and in development of human resources in forestry;to control trafficking in wood and other forestry produce including exportation and importation;to protect fragile areas such as steep slopes, river banks, water catchment and to conserve and enhance biodiversity;to provide guidelines in planning and implementation of forestry research and forestry education;to establish a forestry administration; andto promote bilateral, regional and international co operation in forest augmentation and conservation. ",– 1997,,6,en,"C to promote community involvement in the conservation of trees and forests in forest reserves and protected forest areas in accordance with the provisions of this act;to empower village natural resources management committees to source financial and technical assistance from the private sector, non-governmental organisations and other organisations;to promote sustainable utilisation of timber, fuelwood and other forest produce;to promote optimal land use practices through agroforestry in smallholder farming systems;to update the capability of forestry institutions in the implementation of their resources management responsibilities and in development of human resources in forestry;to control trafficking in wood and other forestry produce including exportation and importation;to protect fragile areas such as steep slopes, river banks, water catchment and to conserve and enhance biodiversity;to provide guidelines in planning and implementation of forestry research and forestry education;to establish a forestry administration; andto promote bilateral, regional and international co-operation in forest augmentation and conservation.",0.4231383916940779,i
635,558,"key policy and institutional strategies and ministerial cooperation  shift domestic government budget allocations from subsidies for mineral fertilizers to support for increased extension services, training, and outreach programs to promote improved agricultural technologies; soil and water conservation; and other flr interventions that promote improved catchment management.  increasingly redirect cash for work programs toward restoration actions natural and build restoration infrastructure.",Forest Landscape Restoration Strategy,,29,en,"Key policy and institutional strategies and ministerial cooperation  shift domestic government budget allocations from subsidies for mineral fertilizers to support for increased extension services, training, and outreach programs to promote improved agricultural technologies; soil and water conservation; and other FLR interventions that promote improved catchment management.  Increasingly redirect cash-for-work programs toward restoration actions natural and build restoration infrastructure.",0.488800313240319,i
652,11412,"the economic strategy for forest landscape restoration in malawi has been on the implementation of the five identified intervention types in locations where the costs will be reduced and the benefits increased. this will be based on the analysis of priorities that demonstrate where the economic benefits from these restoration actions will flow. it is especially important at this stage to ensure that economic benefits from restoration are provided in a fair and equitable manner especially in support of womens leadership and participation in restoration activities and initiatives and their access to and control of land, capital, and credit. ",Forest Landscape Restoration Strategy,,30,en,"The economic strategy for forest landscape restoration in malawi has been on the implementation of the five identified intervention types in locations where the costs will be reduced and the benefits increased. This will be based on the analysis of priorities that demonstrate where the economic benefits from these restoration actions will flow. It is especially important at this stage to ensure that economic benefits from restoration are provided in a fair and equitable manner especially in support of womens leadership and participation in restoration activities and initiatives and their access to and control of land, capital, and credit.",0.401842106069002,i
653,2152,"considering the ambitious commitment to restoration nearly half of malawis land areas coordinated strategy that is inclusive of malawis national economic, social, and development goals as well as its natural resource and management aspirations will be key. the following strategy outlines how the results of the nflra can be operationalized for policies and institutions, stocktaking and mapping, and economics and finance. to create an enabling environment that fosters widespread adoption of the five intervention types identified for scaling up through the nflra and the novel economic opportunities generated through restoration enterprises, different ministries and sectors should recognize that existing agriculture, forest, and climate policies for their sectors all contribute to the same goals. landscape restoration provides a unique opportunity to harmonize this understanding, especially through the implementation of forest landscape restoration over the coming years. the scale of restoration in malawi and the interdependency of all sectors necessitates a coordinated and inter departmental approach to this landscape strategy that is supported by a genuine national restoration movement. broadly, an increase in technical support and training through extension services on the components of this strategy will fundamentally determine the trajectory of malawis restoration commitment. ",Forest Landscape Restoration Strategy,,32,en,"Considering the ambitious commitment to restoration nearly half of malawis land areas coordinated strategy that is inclusive of malawis national economic, social, and development goals as well as its natural resource and management aspirations will be key. The following strategy outlines how the results of the nflra can be operationalized for policies and institutions, stocktaking and mapping, and economics and finance. To create an enabling environment that fosters widespread adoption of the five intervention types identified for scaling up through the nflra and the novel economic opportunities generated through restoration enterprises, different ministries and sectors should recognize that existing agriculture, forest, and climate policies for their sectors all contribute to the same goals. Landscape restoration provides a unique opportunity to harmonize this understanding, especially through the implementation of forest landscape restoration over the coming years. The scale of restoration in malawi and the interdependency of all sectors necessitates a coordinated and inter-departmental approach to this landscape strategy that is supported by a genuine national restoration movement. Broadly, an increase in technical support and training through extension services on the components of this strategy will fundamentally determine the trajectory of malawis restoration commitment.",0.40497689829486294,n
656,6311,"there are several ways to reduce the information barrier to promote more widespread adoption of restoration activities. it is critically important to increase investment in extension, outreach, and knowledge sharing programs separately designed for women and men to reduce knowledge and skill barriers and promote adoption. outreach activities, like farm radio programs, can also reduce information barriers by discussing the practical steps of implementing different restoration activities and highlighting the benefits that smallholders could expect to receive. the following strategies can facilitate the scaling up of restoration in malawi  dedicate more resources to communication and outreach about the benefits of restoration through rural radio, expanded extension services, and support for ngos to provide community support.",Forest Landscape Restoration Strategy,,32,en,"There are several ways to reduce the information barrier to promote more widespread adoption of restoration activities. It is critically important to increase investment in extension, outreach, and knowledge-sharing programs separately designed for women and men to reduce knowledge and skill barriers and promote adoption. Outreach activities, like farm radio programs, can also reduce information barriers by discussing the practical steps of implementing different restoration activities and highlighting the benefits that smallholders could expect to receive. The following strategies can facilitate the scaling up of restoration in malawi  dedicate more resources to communication and outreach about the benefits of restoration through rural radio, expanded extension services, and support for ngos to provide community support.",0.40737350615084605,n
660,3127,"agricultural technologies to create an enabling environment that fosters widespread adoption of agricultural technologies, existing agriculture, forest, and climate policies need harmonization. these include the national agriculture policy 201 6, the national forest policy 201 6, and the national climate change policy 201 5. the national climate change investment plan 201 3 also highlights agriculture as a key sector through which to enhance climate change resilience, while malawis national adaptation programme of action 200 6 outlines agricultural interventions aimed at boosting womens resilience to climate change. ",Forest Landscape Restoration Strategy,,33,en,"Agricultural technologies to create an enabling environment that fosters widespread adoption of agricultural technologies, existing agriculture, forest, and climate policies need harmonization. These include the national agriculture policy 2016, the national forest policy 2016, and the national climate change policy 2015. The national climate change investment plan 2013 also highlights agriculture as a key sector through which to enhance climate change resilience, while malawis national adaptation programme of action 2006 outlines agricultural interventions aimed at boosting womens resilience to climate change.",0.412567326572398,n
663,791,"  shift domestic government budget allocations from subsidies for mineral fertilizers to support for increased extension services, training and outreach programs to promote conservation agriculture, fmnr and agroforestry, and soil and water conservation. ",Forest Landscape Restoration Strategy,,33,en,"Shift domestic government budget allocations from subsidies for mineral fertilizers to support for increased extension services, training and outreach programs to promote conservation agriculture, FMNR and agroforestry, and soil and water conservation.",0.439967537792227,i
664,863,"  improve coordination between the department of forestry and the ministry of agriculture, irrigation, and water development to align and increase resource allocations for tree based restoration interventions on farms. ",Forest Landscape Restoration Strategy,,33,en,"Improve coordination between the department of forestry and the ministry of agriculture, irrigation, and water development to align and increase resource allocations for tree-based restoration interventions on farms.",0.418919345409991,i
675,11610,"  complement local investments in establishing and managing community forests and woodlots with small grants and technical support to strengthen associated forest product value chains and reinforce the economic returns and incentives for communities and user groups to invest in these restoration interventions. this could include assistance with the development of beekeeping and honey production, and value added processing and marketing of a range of timber and nontimber forest products from community forests and woodlots.",Forest Landscape Restoration Strategy,,34,en,"Complement local investments in establishing and managing community forests and woodlots with small grants and technical support to strengthen associated forest product value chains and reinforce the economic returns and incentives for communities and user groups to invest in these restoration interventions. This could include assistance with the development of beekeeping and honey production, and value-added processing and marketing of a range of timber and nontimber forest products from community forests and woodlots.",0.40226922250676295,i
677,13112,"  create and support institutions to extend credit to smallholders with an interest in investing in plantation forestry, expansion of woodlots, and value added processing and marketing of tree and forest products.",Forest Landscape Restoration Strategy,,34,en,"Create and support institutions to extend credit to smallholders with an interest in investing in plantation forestry, expansion of woodlots, and value-added processing and marketing of tree and forest products.",0.44746904482793,i
689,5102,  focus the government public works program cash for work scheme on soil and water conservation activities in watersheds at high risk for flooding and erosion. these programs especially the world bank funded malawi social action fund and its public works programme provide significant inputs that could be more strongly directed toward restoration actions at the village level.,Forest Landscape Restoration Strategy,,36,en,Focus the government public works program cash-for-work scheme on soil and water conservation activities in watersheds at high risk for flooding and erosion. These programs especially the world bank funded malawi social action fund and its public works programme provide significant inputs that could be more strongly directed toward restoration actions at the village level.,0.4322836772845,i
